{
  "schemaVersion": "hacp-0.2-draft",
  "recordKind": "hacp.adapter_report",
  "adapterReportId": "report_example_stale_0001",
  "handoffPackageId": "handoff_example_old_0001",
  "handoffPackageDigest": {
    "algorithm": "sha256",
    "canonicalization": "json-rfc8785-jcs",
    "digestDomain": "handoff_package_v0.2",
    "value": "1212121212121212121212121212121212121212121212121212121212121212"
  },
  "authorityPacketId": "packet_example_0001",
  "createdAt": "2026-05-11T12:29:00Z",
  "adapter": {
    "adapterKind": "codex_cli_manual_example",
    "workspaceLabel": "example_workspace"
  },
  "changedArtifacts": [],
  "verificationEvidence": [
    {
      "label": "stale_handoff_check",
      "outcome": "blocked",
      "summary": "Report references an older handoff and requires human review."
    }
  ],
  "residualRisks": [],
  "boundariesPreserved": true,
  "boundaryCrossedReason": [],
  "stopConditionStatus": "blocked",
  "requestedNextStep": "request_human_decision",
  "digest": {
    "algorithm": "sha256",
    "canonicalization": "json-rfc8785-jcs",
    "digestDomain": "adapter_report_v0.2",
    "value": "1313131313131313131313131313131313131313131313131313131313131313"
  }
}
